{
  "schemaVersion": "0.1.0",
  "proofId": "font-swap-proof:sp-drill-001",
  "targetRef": "target:socioprophet-web-frontend",
  "replacedFont": "CustomBrandFont",
  "substituteFont": "Inter",
  "syntheticOnly": true,
  "rollbackVerified": true,
  "proofRefs": ["proof:font-swap-rollback-screenshot-001"],
  "approvedBy": ["Michael Heller"],
  "executionPerformed": false
}
